{
  "$schema": "./conformance-fixtures.schema.json",
  "version": "attestor.crypto-execution-admission-conformance-fixtures.v1",
  "schemaDialect": "https://json-schema.org/draft/2020-12/schema",
  "generatedAt": "2026-04-22T22:00:00.000Z",
  "description": "Adapter-neutral Attestor crypto execution admission conformance fixtures for external wallets, guards, bundlers, payment servers, custody engines, and solvers.",
  "fixtureSigner": {
    "keyId": "attestor-crypto-admission-conformance-fixture-key-v1",
    "secret": "attestor-conformance-fixture-secret-v1",
    "purpose": "fixture-only"
  },
  "requiredSurfaces": [
    "wallet-rpc",
    "smart-account-guard",
    "account-abstraction-bundler",
    "modular-account-runtime",
    "delegated-eoa-runtime",
    "agent-payment-http",
    "custody-policy-engine",
    "intent-solver"
  ],
  "fixtures": [
    {
      "fixtureId": "wallet-rpc-admitted-v1",
      "surface": "wallet-rpc",
      "adapterKind": "wallet-call-api",
      "standards": [
        "EIP-5792",
        "ERC-7715",
        "ERC-7902"
      ],
      "scenario": "Wallet call bundle is admitted after capability and permission evidence is present.",
      "expectedSignal": "admitted",
      "expectedReceiptClassification": "admitted",
      "expectedPlanOutcome": "admit",
      "expectedDownstreamAction": "wallet_sendCalls",
      "plan": {
        "version": "attestor.crypto-execution-admission.v1",
        "planId": "plan-wallet-rpc-admitted-v1",
        "createdAt": "2026-04-22T22:01:00.000Z",
        "integrationRef": "integration:conformance:wallet-rpc",
        "simulationId": "simulation-wallet-rpc-admitted-v1",
        "simulationDigest": "sha256:28316afbde5f68c60827726f0220e5803bc657a84e5aa862bef0d8ce6a703960",
        "intentId": "intent-wallet-rpc-admitted-v1",
        "consequenceKind": "batch-call",
        "adapterKind": "wallet-call-api",
        "surface": "wallet-rpc",
        "outcome": "admit",
        "chainId": "eip155:8453",
        "accountAddress": "0x0000000000000000000000000000000000000001",
        "standards": [
          "EIP-5792",
          "ERC-7715",
          "ERC-7902"
        ],
        "requiredHandoffArtifacts": [
          "attestor-release-authorization",
          "wallet-capabilities",
          "prepared-call-bundle"
        ],
        "transportHeaders": [],
        "steps": [
          {
            "stepId": "wallet-rpc-admitted-v1:release-authorization",
            "kind": "collect-release-authorization",
            "surface": "wallet-rpc",
            "status": "satisfied",
            "reasonCode": "release-authorization-ready",
            "message": "Conformance fixture binds Attestor release authorization before downstream execution.",
            "source": "admission-planner",
            "standards": [
              "attestor-release-layer"
            ],
            "evidence": {
              "fixtureId": "wallet-rpc-admitted-v1"
            }
          },
          {
            "stepId": "wallet-rpc-admitted-v1:downstream-action",
            "kind": "submit-execution",
            "surface": "wallet-rpc",
            "status": "required",
            "reasonCode": "downstream-execution-admitted",
            "message": "External integrator must honor the admitted, blocked, or missing-evidence decision.",
            "source": "admission-planner",
            "standards": [
              "EIP-5792",
              "ERC-7715",
              "ERC-7902"
            ],
            "evidence": {
              "action": "wallet_sendCalls"
            }
          },
          {
            "stepId": "wallet-rpc-admitted-v1:receipt",
            "kind": "record-admission-receipt",
            "surface": "attestor-core",
            "status": "required",
            "reasonCode": "admission-receipt-required",
            "message": "External integrator records the signed admission receipt for audit and replay protection.",
            "source": "admission-planner",
            "standards": [
              "attestor-evidence"
            ],
            "evidence": {
              "receiptRequired": true
            }
          }
        ],
        "blockedReasons": [],
        "nextActions": [
          "wallet_sendCalls",
          "record-admission-receipt"
        ],
        "operatorNote": null,
        "canonical": "{}",
        "digest": "sha256:807f1d12c3e0db441130942c336d6c6ccbd2caffcb4942c47358d3b9651f999c"
      },
      "subject": {
        "subjectKind": "wallet-rpc-handoff",
        "subjectId": "subject-wallet-rpc-admitted-v1",
        "subjectDigest": "sha256:51372c069e59d458d32220b6070a36dc5117a9bb92b9db1417ba173ad413cf7f",
        "surface": "wallet-rpc",
        "adapterKind": "wallet-call-api",
        "outcome": "ready",
        "action": "wallet_sendCalls",
        "planId": "plan-wallet-rpc-admitted-v1",
        "planDigest": "sha256:807f1d12c3e0db441130942c336d6c6ccbd2caffcb4942c47358d3b9651f999c"
      },
      "telemetryEvent": {
        "version": "attestor.crypto-execution-admission-telemetry.v1",
        "specversion": "1.0",
        "id": "cate_b56686c193d445fa8c8d5fb34ef865d1",
        "type": "attestor.crypto_execution_admission.decision",
        "source": "attestor.crypto-execution-admission.conformance",
        "subject": "wallet-rpc/wallet-rpc-handoff/subject-wallet-rpc-admitted-v1",
        "time": "2026-04-22T22:01:01.000Z",
        "datacontenttype": "application/json",
        "traceparent": "00-b2209115a55d182fe9ee16cc1c193ede-d22c6455b129f394-01",
        "tracestate": null,
        "signal": "admitted",
        "severityText": "INFO",
        "severityNumber": 9,
        "attributes": {
          "attestor.crypto_admission.signal": "admitted",
          "attestor.crypto_admission.surface": "wallet-rpc",
          "attestor.crypto_admission.adapter_kind": "wallet-call-api",
          "attestor.crypto_admission.plan_outcome": "admit",
          "attestor.crypto_admission.subject_kind": "wallet-rpc-handoff",
          "attestor.crypto_admission.subject_outcome": "ready",
          "attestor.crypto_admission.failure_reason_count": 0,
          "attestor.crypto_admission.failure_reasons": [],
          "attestor.crypto_admission.receipt_id": "receipt-wallet-rpc-admitted-v1",
          "event.name": "attestor.crypto_execution_admission.decision",
          "attestor.conformance.fixture_id": "wallet-rpc-admitted-v1",
          "attestor.conformance.surface": "wallet-rpc"
        },
        "data": {
          "planId": "plan-wallet-rpc-admitted-v1",
          "planDigest": "sha256:807f1d12c3e0db441130942c336d6c6ccbd2caffcb4942c47358d3b9651f999c",
          "simulationId": "simulation-wallet-rpc-admitted-v1",
          "simulationDigest": "sha256:28316afbde5f68c60827726f0220e5803bc657a84e5aa862bef0d8ce6a703960",
          "intentId": "intent-wallet-rpc-admitted-v1",
          "surface": "wallet-rpc",
          "adapterKind": "wallet-call-api",
          "planOutcome": "admit",
          "signal": "admitted",
          "subjectKind": "wallet-rpc-handoff",
          "subjectId": "subject-wallet-rpc-admitted-v1",
          "subjectDigest": "sha256:51372c069e59d458d32220b6070a36dc5117a9bb92b9db1417ba173ad413cf7f",
          "subjectOutcome": "ready",
          "failureReasons": [],
          "receiptId": "receipt-wallet-rpc-admitted-v1"
        },
        "body": "wallet-rpc conformance fixture admitted",
        "eventDigest": "sha256:6cb4a203bf3d1cf318460baf64523c73a8a2d4dc9c9afca8c920ee337ad9a6fd"
      },
      "receipt": {
        "version": "attestor.crypto-execution-admission-receipt.v1",
        "receiptId": "receipt-wallet-rpc-admitted-v1",
        "issuedAt": "2026-04-22T22:01:00.000Z",
        "issuer": "attestor.crypto-execution-admission",
        "serviceId": "attestor-crypto-execution-admission-conformance",
        "classification": "admitted",
        "planId": "plan-wallet-rpc-admitted-v1",
        "planDigest": "sha256:807f1d12c3e0db441130942c336d6c6ccbd2caffcb4942c47358d3b9651f999c",
        "simulationId": "simulation-wallet-rpc-admitted-v1",
        "simulationDigest": "sha256:28316afbde5f68c60827726f0220e5803bc657a84e5aa862bef0d8ce6a703960",
        "intentId": "intent-wallet-rpc-admitted-v1",
        "surface": "wallet-rpc",
        "adapterKind": "wallet-call-api",
        "planOutcome": "admit",
        "subject": {
          "subjectKind": "wallet-rpc-handoff",
          "subjectId": "subject-wallet-rpc-admitted-v1",
          "subjectDigest": "sha256:51372c069e59d458d32220b6070a36dc5117a9bb92b9db1417ba173ad413cf7f",
          "surface": "wallet-rpc",
          "adapterKind": "wallet-call-api",
          "outcome": "ready",
          "action": "wallet_sendCalls",
          "planId": "plan-wallet-rpc-admitted-v1",
          "planDigest": "sha256:807f1d12c3e0db441130942c336d6c6ccbd2caffcb4942c47358d3b9651f999c"
        },
        "trace": {
          "traceparent": "00-b2209115a55d182fe9ee16cc1c193ede-d22c6455b129f394-01",
          "tracestate": null
        },
        "failureReasons": [],
        "evidenceDigest": "sha256:33980f8039ceb6fba34148df31894215d2fc9044765109bcb45d32d43201f9d9",
        "receiptDigest": "sha256:23d8a0b710332362bfd27a033cdd1a742770f4f7663b9b9983e25b62f24a9159",
        "signature": {
          "mode": "hmac-sha256",
          "keyId": "attestor-crypto-admission-conformance-fixture-key-v1",
          "signedPayloadDigest": "sha256:23d8a0b710332362bfd27a033cdd1a742770f4f7663b9b9983e25b62f24a9159",
          "value": "hmac-sha256:c1dfca6e6d6fae295df22a4eb17730e55bc7b42c017140d0e35fc56b0f8f7d02"
        }
      },
      "externalIntegratorAssertions": [
        "MUST NOT submit downstream execution when plan.outcome is deny.",
        "MUST collect the missing evidence and rerun admission when plan.outcome is needs-evidence.",
        "MUST bind telemetry subject planId and planDigest to the admission plan before emitting telemetry.",